<UseCases xmlns:xsi=http://www.w3.org/2001/XMLSchema-instance xsi:noNamespaceSchemaLocation="schemas/gdl/UseCases.xsd">
	<UseCase>
		<UseCaseID>Case 1</UseCaseID>
		<UseCaseName>Small Virtual Application</UseCaseName>
		<UseCaseDescription><![CDATA[Consists of translating between two simulation environments with a low number of persistent and transient objects with a high update rate. The message traffic would be continuous. The complexity of the translations would be low, implying simple objects and minimal translations. No new persistent objects would be created or deleted during the execution. Profile 1 might be characterized by a hardware-in-the-loop or a human-in-the-loop virtual simulator with small numbers of member applications.]]></UseCaseDescription>
		<ScenarioParameters>
			<PersistentObjectCount>Low</PersistentObjectCount>
			<TransientObjectCount>Low</TransientObjectCount>
			<UpdateRate>High</UpdateRate>
			<TrafficPattern>Continuous</TrafficPattern>
			<ComplexityOfTranslation>Low</ComplexityOfTranslation>
			<ObjectCreation>Static</ObjectCreation>
		</ScenarioParameters>
	</UseCase>
	<UseCase>
		<UseCaseID>Case 2</UseCaseID>
		<UseCaseName>Small LVC Event</UseCaseName>
		<UseCaseDescription><![CDATA[Consists of a simulation environment with a low number of persistent objects and a medium number of transient messages. The update rate would be very high with a continuous traffic pattern. The translations would be of medium complexity. No new objects would be created during the execution of the simulation and all objects would be deleted at the end of the execution cycle.]]></UseCaseDescription>
		<ScenarioParameters>
			<PersistentObjectCount>Medium</PersistentObjectCount>
			<TransientObjectCount>Medium</TransientObjectCount>
			<UpdateRate>VeryHigh</UpdateRate>
			<TrafficPattern>Continuous</TrafficPattern>
			<ComplexityOfTranslation>Medium</ComplexityOfTranslation>
			<ObjectCreation>Static</ObjectCreation>
		</ScenarioParameters>
	</UseCase>
	<UseCase>
		<UseCaseID>Case 3</UseCaseID>
		<UseCaseName>Medium LVC Event</UseCaseName>
		<UseCaseDescription><![CDATA[Consists of a medium number of persistent objects but a high number of transient messages. The update rate would be medium not exceeding 1 hertz. The traffic patterns would be “bursty” (more than 50% above the average numbers). The simulation would have a great number of updates in a short time period, followed by a lull. The translation complexity would be medium (more than direct algorithmic translations). Objects will be created and destroyed dynamically during the execution.]]></UseCaseDescription>
		<ScenarioParameters>
			<PersistentObjectCount>Medium</PersistentObjectCount>
			<TransientObjectCount>High</TransientObjectCount>
			<UpdateRate>Medium</UpdateRate>
			<TrafficPattern>Burst Mode</TrafficPattern>
			<ComplexityOfTranslation>Medium</ComplexityOfTranslation>
			<ObjectCreation>Dynamic</ObjectCreation>
		</ScenarioParameters>
	</UseCase>
	<UseCase>
		<UseCaseID>Case 4</UseCaseID>
		<UseCaseName>Large Constructive Application</UseCaseName>
		<UseCaseDescription><![CDATA[Consists of a high number of persistent objects (greater than 10,000) and a medium number of transient messages (100 per second). The update rate would be low (20 persistent objects updated per second). The traffic pattern would be bursty. The translation complexity would be high. Objects will be created and destroyed dynamically during the execution.]]></UseCaseDescription>
		<ScenarioParameters>
			<PersistentObjectCount>High</PersistentObjectCount>
			<TransientObjectCount>Medium</TransientObjectCount>
			<UpdateRate>Low</UpdateRate>
			<TrafficPattern>Burst Mode</TrafficPattern>
			<ComplexityOfTranslation>High</ComplexityOfTranslation>
			<ObjectCreation>Dynamic</ObjectCreation>
		</ScenarioParameters>
	</UseCase>
	<UseCase>
		<UseCaseID>Case 5</UseCaseID>
		<UseCaseName>Large LVC Event</UseCaseName>
		<UseCaseDescription><![CDATA[Consists of a high number of persistent and transient objects with a medium update rates. Bursty traffic would be used. The required translation complexity would be high. No new objects will be created during the execution and all objects would be destroyed at the end of the execution.]]></UseCaseDescription>
		<ScenarioParameters>
			<PersistentObjectCount>High</PersistentObjectCount>
			<TransientObjectCount>High</TransientObjectCount>
			<UpdateRate>Medium</UpdateRate>
			<TrafficPattern>Burst Mode</TrafficPattern>
			<ComplexityOfTranslation>High</ComplexityOfTranslation>
			<ObjectCreation>Static</ObjectCreation>
		</ScenarioParameters>
	</UseCase>
	<UseCase>
		<UseCaseID>Case 6</UseCaseID>
		<UseCaseName>High Count Event</UseCaseName>
		<UseCaseDescription><![CDATA[Consists of a very high number of persistent and transient objects, medium update rate with bursty traffic patterns.  Translation complexity would be medium with dynamic object creation and deletion.  This is an “extreme case” beyond the normal large LVC event to address a hypothetical future application that gateways might be expected to support.]]></UseCaseDescription>
		<ScenarioParameters>
			<PersistentObjectCount>VeryHigh</PersistentObjectCount>
			<TransientObjectCount>VeryHigh</TransientObjectCount>
			<UpdateRate>Medium</UpdateRate>
			<TrafficPattern>Burst Mode</TrafficPattern>
			<ComplexityOfTranslation>Medium</ComplexityOfTranslation>
			<ObjectCreation>Dynamic</ObjectCreation>
		</ScenarioParameters>
	</UseCase>
</UseCases>
